<!ELEMENT productos (producto+)>
<!ELEMENT producto (nombre, precio, descripcion, imagen)>
<!ELEMENT nombre (#PCDATA)>
<!ELEMENT precio (#PCDATA)>
<!ELEMENT descripcion (#PCDATA)>
<!ELEMENT imagen (#PCDATA)>
